{
  "db_instance_identifier": "orders-prod",
  "region": "us-east-1",
  "current_instance_class": "db.t4g.large",
  "target_instance_class": "db.r6g.xlarge",
  "apply_immediately": true,
  "success_criteria": {
    "metric": "CPUUtilization",
    "threshold_percent": 60,
    "verification_window": "5m"
  },
  "reasoning": "switching to memory-optimized family"
}
